{
  "id": "rv-yeongho-interview",
  "projectId": "sample",
  "personaId": "p-yeongho",
  "sessionId": "ss-yeongho-01",
  "type": "interview",
  "title": "데모 사용 인터뷰 — 동네 범위가 눈에 보인다는 것",
  "body": "Q: 오늘 데모를 직접 써보셨는데, 전체적인 인상이 어떠셨습니까?\nA: 처음에는 화면이 너무 단순해서 '이게 전부인가' 싶었습니다. 그런데 제 위치가 잡히고 경계선이 그려지는 걸 보니 의도가 분명한 서비스더군요. 저는 가게 전단지를 어느 동네까지 돌릴지 늘 고민인데, 동네 범위를 눈으로 확인할 수 있다는 건 분명히 쓸모가 있었습니다.\nQ: 사용하면서 불편했던 지점이 있었다면요?\nA: 두 가지입니다. 첫째, 글씨가 작습니다. 제 나이대는 지도 위의 동 이름이 한눈에 들어와야 하는데 확대를 몇 번이나 해야 했습니다. 둘째, 위치 권한 안내가 너무 갑자기 떠서 순간 망설였습니다. 왜 필요한지 한 줄이라도 먼저 설명해 주면 좋겠습니다.\nQ: 주변에 추천할 의향이 있으십니까?\nA: 장사하는 사람들한테는 권할 만합니다. 다만 지금은 데모 수준이니, 경계 화면을 인쇄하거나 공유하는 기능이 붙어야 실제 업무에는 쓸 것 같습니다.",
  "suggestions": [
    "동 이름 글자 크기 확대 옵션",
    "위치 권한 요청 전에 필요한 이유를 먼저 안내",
    "경계 화면 이미지 저장·공유 기능"
  ],
  "generatedBy": "sample-fixture",
  "createdAt": "2026-07-25"
}
