{
  "id": "rv-minseo-sns",
  "projectId": "sample",
  "personaId": "p-minseo",
  "sessionId": "ss-minseo-01",
  "type": "sns",
  "body": "now-here라는 데모를 써봤다. 지도를 열면 내가 서 있는 동네의 경계를 그려주는 앱.\n길찾기 앱들은 '여기가 무슨 동인지'는 안 알려준다. 이건 그 질문 하나만 답한다. 이런 좁은 컨셉을 좋아하는 편.\n근데 경계선 색이 도로랑 비슷해서 축소하면 잘 안 보인다. 핵심 기능이 제일 안 보이는 상태.\n현재 위치 버튼도 아이콘이 흐려서 처음에 못 찾았다. 발견성 테스트를 안 해본 것 같다.\n그래도 부동산 보러 다닐 때는 쓸 예정. 두 동네에 걸친 골목이 바로 보이는 건 확실히 유용하다.\n결론: 방향은 맞고 마감이 덜 됐다. 지금은 3점, 잠재력은 4점.",
  "suggestions": [
    "경계선 고대비 모드 (야외 사용 고려)"
  ],
  "generatedBy": "sample-fixture",
  "createdAt": "2026-07-25"
}
