{
  "id": "rv-minseo-appstore",
  "projectId": "sample",
  "personaId": "p-minseo",
  "sessionId": "ss-minseo-01",
  "type": "appstore",
  "rating": 3,
  "title": "컨셉은 정확한데 마감이 아쉽다",
  "body": "이사 온 지 얼마 안 돼서 '우리 동네가 정확히 어디까지인가'가 궁금했는데, 이 질문 하나에는 정확히 답해주는 앱이다. 지도를 열면 현재 위치 기준으로 동네 경계가 그려지고, 옆 동네를 탭하면 이름까지 나온다. 길찾기 앱들이 안 해주는 걸 하나만 골라서 하는 방향성은 좋다.\n다만 완성도 문제가 몇 개 있다. 첫째, 접속 후 지도가 내 위치로 자동 이동하지 않는데 현재 위치 버튼 아이콘이 흐려서 한참 찾았다. 둘째, 경계선 색이 도로 색과 비슷해서 축소하면 구분이 안 된다. 이 앱의 존재 이유가 경계선인데 경계선이 제일 안 보이는 건 문제다. 셋째, 위치 권한을 요구하면서 왜 필요한지 설명이 없다.\n부동산 알아볼 때는 계속 쓸 것 같다. 위 세 개가 고쳐지면 별 하나 더 줄 수 있다.",
  "pros": [
    "'동네 경계'라는 한 가지 질문에 정확히 답함",
    "옆 동네 이름 확인이 탭 한 번",
    "불필요한 정보 없이 화면이 깔끔함"
  ],
  "cons": [
    "경계선 색이 도로와 비슷해 축소하면 구분 안 됨",
    "현재 위치 버튼 발견성이 나쁨 (아이콘이 흐림)",
    "위치 권한 요청에 이유 설명이 없음"
  ],
  "suggestions": [
    "경계선 색상·두께 대비 강화 (핵심 기능이므로 최우선)",
    "첫 실행 시 현재 위치로 자동 이동 또는 버튼 안내",
    "위치 권한 요청 시 사용 목적 한 줄 표시"
  ],
  "generatedBy": "sample-fixture",
  "createdAt": "2026-07-25"
}
